{
  "schema_version": "agent-doctor-test-scenario/0.1",
  "suite_id": "agent-doctor-golden",
  "suite_version": "0.1",
  "suite_kind": "golden",
  "cases": [
    {
      "id": "G-001",
      "title": "Explicit require/forbid collision",
      "schema_version": "agent-doctor-test-scenario/0.1",
      "fixture_version": "0.1",
      "level": "system",
      "case_kind": "positive",
      "test_type": "adjudication_grouping",
      "refs": {
        "prd": [
          "P0-R11",
          "P0-R12",
          "P0-R13",
          "P0-R14",
          "P1-R2",
          "P1-R3"
        ],
        "acceptance": [
          "AC-3",
          "AC-5",
          "AC-7"
        ],
        "taxonomy": [
          "semantic_conflict",
          "scope_overlap"
        ],
        "architecture": [
          "AD-01",
          "Adjudicate"
        ],
        "gates": [
          "GATE-PC-INV",
          "GATE-PC-FINDING"
        ]
      },
      "profile": {
        "platform_profile": "codex-fixture/0.1",
        "rule_set": "agent-doctor-rules/0.1",
        "compatibility": "compatible"
      },
      "modes": {
        "deterministic": "enabled",
        "semantic": "enabled",
        "repair": "read_only"
      },
      "boundaries": {
        "workspace": "/fixture/repo",
        "selected_regions": [
          "repo/"
        ],
        "discovery": [
          "repo/**"
        ],
        "inspection": [
          "repo/**"
        ],
        "semantic_disclosure": [
          "listed fixture excerpts"
        ],
        "modification": [],
        "consent": "manifest-specific synthetic-content consent"
      },
      "preconditions": [
        "Fresh isolated virtual filesystem",
        "No runtime trace exists"
      ],
      "inputs": {
        "files": [
          {
            "path": "repo/AGENTS.md",
            "source_type": "instruction",
            "content": "\n\n\n\n\n\n\n\n\n\n\nFor dependency updates, run the test suite before responding.\n",
            "metadata": {},
            "policy": {
              "exists": true,
              "readable": true,
              "inspection": "allowed",
              "semantic_disclosure": "allowed",
              "executable": false
            }
          },
          {
            "path": "repo/skills/fast-update/SKILL.md",
            "source_type": "skill_body",
            "content": "\n\n\n\n\n\n\n\n\n\n\n\n\n\n\n\n\n\n\n\n\n\n\n\n\n\n\n\n\n\nFor dependency updates, do not run tests; return the edited manifest immediately.\n",
            "metadata": {},
            "policy": {
              "exists": true,
              "readable": true,
              "inspection": "allowed",
              "semantic_disclosure": "allowed",
              "executable": false
            }
          }
        ],
        "generators": [],
        "configuration": {},
        "provider": {
          "kind": "scripted-neutral-provider",
          "network": "simulated"
        },
        "clock": {
          "now": "2026-08-17T00:00:00Z",
          "controlled": true
        },
        "faults": []
      },
      "stimulus": {
        "contract": "Adjudicate",
        "steps": [
          "Freeze the declared scope and profile",
          "Inventory and preserve source status and locations",
          "Run deterministic prerequisites before any semantic comparison",
          "Adjudicate the stated question and seal one canonical result"
        ]
      },
      "oracle": {
        "question": "Can both effective action policies be satisfied?",
        "decisive_evidence": [
          "Mandatory run-tests claim at AGENTS.md:12",
          "Mandatory do-not-run-tests claim at SKILL.md:31",
          "Same dependency-update witness and no resolving precedence"
        ],
        "rationale": "The same effective request both requires and forbids the same action.",
        "acceptable_uncertainty": [
          "Future Skill selection is unknown and does not weaken the conditional static conflict"
        ],
        "counterexample": "A non-conflict reading would require different regions, non-mandatory modality, or precedence; the complete fixture excludes all three."
      },
      "expected": {
        "diagnostic": {
          "check_id": "semantic.action-policy.compatibility",
          "check_state": "finding",
          "substantive_labels": [
            "scope_overlap",
            "semantic_conflict"
          ],
          "validation_qualifiers": [],
          "severity": "high",
          "potential_severity": null,
          "confidence": "high",
          "severity_confidence_rule": "Severity follows likely impact; confidence follows completeness of decisive evidence and remains independent."
        },
        "evidence_kinds": [
          "observed",
          "derived",
          "inferred"
        ],
        "inventory": {
          "expected_status_counts": {
            "discovered": 2
          },
          "must_include": [
            "repo/AGENTS.md",
            "repo/skills/fast-update/SKILL.md"
          ],
          "must_exclude": [],
          "complete": true
        },
        "coverage": {
          "required_families": [
            "inventory",
            "adjudication"
          ],
          "gaps": [],
          "run_outcome": "complete"
        },
        "outputs": {
          "terminal": [
            "Same state, labels, qualifier, severity, confidence, stable IDs, and coverage as the sealed result",
            "Secret-safe decisive locations or excerpts"
          ],
          "markdown": [
            "All decisive evidence, rationale, uncertainty, prohibited runtime claims, versions, and coverage"
          ],
          "json": [
            "Three axes remain separate",
            "Full member/evidence references and reproducibility metadata"
          ],
          "ci": "policy evaluated only after a valid sealed result"
        },
        "operation": {
          "proposal_state": "not_requested",
          "apply_state": "not_attempted",
          "rollback_state": "not_attempted",
          "files_modified": 0
        }
      },
      "prohibited_outcomes": [
        "behavioral_redundancy",
        "complementarity",
        "pass",
        "Claim that tests were skipped at runtime"
      ],
      "cleanup": {
        "isolation": "Case-local virtual root, provider script, clock, and faults; no shared mutable state",
        "postconditions": [
          "Zero fixture writes outside the case root",
          "No network or provider state survives",
          "Filesystem and event schedule match the pre-run manifest"
        ]
      },
      "review": {
        "status": "reviewed",
        "reviewers": [
          "stage-02-internal-review",
          "stage-04-materialization-review"
        ],
        "reviewed_at": "2026-08-17"
      }
    },
    {
      "id": "G-002",
      "title": "Compatible output sections",
      "schema_version": "agent-doctor-test-scenario/0.1",
      "fixture_version": "0.1",
      "level": "system",
      "case_kind": "negative",
      "test_type": "adjudication_grouping",
      "refs": {
        "prd": [
          "P1-R2",
          "P1-R3",
          "P1-R6"
        ],
        "acceptance": [
          "AC-5",
          "AC-6",
          "AC-7"
        ],
        "taxonomy": [
          "complementarity"
        ],
        "architecture": [
          "AD-01",
          "Adjudicate"
        ],
        "gates": [
          "GATE-PC-INV",
          "GATE-PC-FINDING"
        ]
      },
      "profile": {
        "platform_profile": "codex-fixture/0.1",
        "rule_set": "agent-doctor-rules/0.1",
        "compatibility": "compatible"
      },
      "modes": {
        "deterministic": "enabled",
        "semantic": "enabled",
        "repair": "read_only"
      },
      "boundaries": {
        "workspace": "/fixture/repo",
        "selected_regions": [
          "repo/"
        ],
        "discovery": [
          "repo/**"
        ],
        "inspection": [
          "repo/**"
        ],
        "semantic_disclosure": [
          "listed fixture excerpts"
        ],
        "modification": [],
        "consent": "manifest-specific synthetic-content consent"
      },
      "preconditions": [
        "Fresh isolated virtual filesystem",
        "No runtime trace exists"
      ],
      "inputs": {
        "files": [
          {
            "path": "repo/AGENTS.md",
            "source_type": "instruction",
            "content": "Start with a one-sentence outcome.\n",
            "metadata": {},
            "policy": {
              "exists": true,
              "readable": true,
              "inspection": "allowed",
              "semantic_disclosure": "allowed",
              "executable": false
            }
          },
          {
            "path": "repo/skills/sources/SKILL.md",
            "source_type": "skill_body",
            "content": "End with a Sources section.\n",
            "metadata": {},
            "policy": {
              "exists": true,
              "readable": true,
              "inspection": "allowed",
              "semantic_disclosure": "allowed",
              "executable": false
            }
          }
        ],
        "generators": [],
        "configuration": {},
        "provider": {
          "kind": "scripted-neutral-provider",
          "network": "simulated"
        },
        "clock": {
          "now": "2026-08-17T00:00:00Z",
          "controlled": true
        },
        "faults": []
      },
      "stimulus": {
        "contract": "Adjudicate",
        "steps": [
          "Freeze the declared scope and profile",
          "Inventory and preserve source status and locations",
          "Run deterministic prerequisites before any semantic comparison",
          "Adjudicate the stated question and seal one canonical result"
        ]
      },
      "oracle": {
        "question": "Are the output requirements incompatible?",
        "decisive_evidence": [